title,publishedAt,url,full_text
33 quick Assassin’s Creed Shadows tips in no particular order,2025-03-19T18:43:49Z,https://www.polygon.com/assassins-creed-shadows-guides/540303/beginners-tips-tricks-before-you-start,"Nothing is true — except this starter advice
byAri Notis
Make no mistake:Assassin’s Creed Shadowsis an Assassin’s Creed game to its core. You probably have a general idea of what to expect. Sneaking past bad guys. Stabbing bad guys. Climbing tall structures and elegantly diving into hay bales that happen to be next to some bad guys (who you then stab).
Still, thanks to its massive scope,Assassin’s Creed Shadowshas so many moving parts even the most stalwart series fan can get tripped up.
Below, we’ve collected 33beginner’s tips forAssassins’s Creed Shadows.
1.Before you start:Immersive modeis actually really cool. Rather than one language track, you’ll hear characters speak in their natural tongue (Japanese, Portuguese, English, and so on).
2.Love Assassin’s Creed stories and lore? In that case, before you start, turn oncanon mode, which removes dialogue options. (But if you just want a solid RPG, you can ignore it.)
3.Assassin’s Creed Shadowscan be very visually dark — especially in caves and at nighttime. The screenshot below, for what it’s worth, is unaltered. We recommend turning the brightness up a few notches.
4.Assassin’s Creed Shadowsstars two protagonists (Naoe and Yasuke), but you won’tunlock Yasukefor a while. Like, areallylong while. Even if you’re rushing through themain story, give yourself at least 10 hours.
5.When you’ve eventually unlocked both characters, use Yasuke for combat and Naoe for stealth. For the most part. Naoe isn’t entirely useless in combat, for what it’s worth — just remember to use her kusarigamaweapon. And Yasuke can technically perform stealth attacks, depending on how you invest in his skill trees.
6.The differences extend to navigation, too. Yasuke can run through walls butcan’twalk on tightropes. Naoe can’t move heavy crates butcangrapple across lengthy gaps. And we implore you: At least once, try to do a leap of faith as Yasuke.
7.You can do most quests as either character. Though if you literally are unable to do a quest as one or the other, the game will tell you (either through a notification or through a character’s spoken dialogue, like, “I bet Yasuke can move these crates”).
8.If you’re not in combat or in a restricted zone, you’ll automatically heal back to full health.
9.But you won’t automatically restore any usedrations(that’s Assassin’s Creed speak for “potions”). Instead, you’ll have to find those at shops or in ration-specific loot boxes.
10.Increasing your total ration capacity isn’t a matter of shopping or upgrading equipment but rather… finding a specific NPC. Who doesn’t show up on your map. Yes. Really.
11.The autosave? Surprisingly good, actually! In our testing,Shadowsseems to autosave every two to three minutes, and logs the five most recent autosaves. Between that and the seemingly limitless number of manual saves (on Xbox Series X, at least), you can really save-scum your way through this game if you’d like.
12.You can recruitcompanionsto fight by your side, and even though they map to ability prompts, they actually stick around in combat for a few moments.
13.Also, there’s technicallyromance, but only for a few characters (that we’ve found so far).
14.If you’re riding a horse or other mount, stick to the roads. The countryside ofShadowsis peppered with steep mountains, and the horse controls are already janky enough on flat terrain — no need to introduce a 45º pitch.
15.Actually, just stick to the roads anyway. You’ll stumble upon more shrines, temples, castles, side quests, Hidden Trails, Kofun, and other optional activities that way. Plus, if you try to run through the woods in a straight line to your destination, your screen is gonna look like this:
16.When you first enter a new province, take the time to unlock a bunch of the synchronization points (the eagle symbols). Those are your fast travel spots, and the more you’ve unlocked, the more time you’ll shave off the back-and-forth travel required for the main questline.
17.You can’t fast travel out of restricted areas like enemy bases, camps, and castles.
18.Synchronization points are considered combat-free zones — even if they’re in the middle of a restricted area — so you can always fast travel to and from them.
19.As soon as you can, get the Ascension Boost skill in Naoe’s Shinobi mastery tree. It dramatically increases Naoe’s climbing speed with the grappling hook, which is the fastest way to unlock new synchronization points.
20.Remember the Assassin’s Creed golden rule: If there’s paint on a wall, that means “CLIMB HERE.”
21.Your level determines your base stats (health, attack, defense, and so on). Your knowledge rank determines what tier of skill points you can unlock in mastery trees. Yourmastery pointsare used to unlock those skills.
22.Spend time hunting down knowledge points to expand how many skills you can unlock. Completing Horse Archery, Kata,Kuji-kiri, andLost Pagesare some of the fastest ways to getknowledge points.
23.But don’t worry too much about mastery points. You’ll get a bunch of them just by leveling up (though if you want more, start by attacking castles).
24.You can automatically transmog all of your gear from the start. And after you come across a weapon or armor set for the first time, it’s unlocked as a customization option permanently. In other words, you don’t need to keep it in your inventory.
25.At the start, sell your loot; don’t break it down. The currency, mon, is more valuable than the upgrade materials you get for dismantling weapons and armor.
26.Don’t bother trying to upgrade gear until you’re at least level 20. You cycle through so much gear in your early levels that anything you upgrade, you’ll likely replace in a few levels anyway.
27.There’s a suggested level for each province, and you should largely follow the provinces in order from lowest level to highest, but don’t worry about out-leveling any activities. Province levels will scale with you.
28.When exploring a Kofun (tomb), light the candles as you go. Not only does it help illuminate the space, maddeningly dim as it is, but it also helps you keep tabs on which tunnels you’ve already explored so you don’t end up going in circles.
29.Liberally use yourscoutsto reveal objectives. Though scouts seem like a limited resource, you can restore them quite effectively as needed.
30.Yes, you can pet the dog:
31.And the cat:
32.But watch out for the kitten!
33.To send you on your way with a note of sincerity, though, it’s this: Do not sleep on the Codex menu. As you exploreShadows, you’ll unlock Codex entries about various aspects of Japanese history. Each one is written up in elaborate detail, with many featuring scanned or photographed artworks from real-world museums. On paper, sure, Assassin’s Creed games might tell stories about stabbing — but the root here is and always has been about stories that actually happened. It’s easy to miss this aspect of the game, buried in a menu as it is, but in this regard,Shadowsis as sharp as Assassin’s Creed has ever been.
Just startingAssassin’s Creed Shadows? Beyond our fullAssassin’s Creed Shadowswalkthrough, here are explainers onhow long to beatthe game and when youunlock Yasuke, plus if you should playcanon,immersive, orguided explorationmodes.
The best of Polygon in your inbox, every Friday."
"Half-Life: Alyx, VR’s first — and hopefully not last — killer app, turns 5",2025-03-19T15:21:30Z,https://www.polygon.com/gaming/542162/half-life-alyx-5th-anniversary-vr-pc,"Valve’s masterpiece still carries the platform on its back
byCameron Faulkner
If you buy something from a Polygon link, Vox Media may earn a commission.See our ethics statement.
New Half-Life games make me do stupid things. WhenHalf-Life 2came out on PC, I trekked to GameStop to trade in my Xbox, controllers, and games. I had hoped to score hundreds in trade-in credit, but the associate discovered my console was soft-modded and quartered the quote as a result — barely enough to cover the game. It didn’t run very well on my parents’ eMachines desktop (as a console player at the time, I didn’t know what recommended specs were). I was very sad when a port of the game eventually came to Xbox.
Half-Life: Alyxlaunched on March 23, 2020, nearly five years ago. I actually had a solid gaming PC that could run it. However, I didn’t have a VR headset, which is a necessary component. I immediatelyhadto have one, ideally a model that wouldn’t leave a $1,000 crater in my checking account likeValve’s Indexwould. I ended up buying a refurbishedOculus Riftfor $250 or so, and over the course of a memorable week, I beatAlyx, then promptly returned the headset for a refund while my jaw was still on the floor from its incredible finale.
It wasn’t long until I bought the wire-freeQuest 2later in 2020, another questionable financial decision, but I kept this one. Then I replayedAlyxthe way that it was meant to be experienced, which is with roomscale movement — no headset-tracking base stations required. I could kneel down, turn around, and just generally feel like I existed in the world, without concerns of tripping over a cable tethering me to my PC.
These hoops were worth jumping through forHalf-Life: Alyx, and those of you who’ve played it would likely agree. I haven’t played a VR game since with as much graphical polish, as much atmosphere, or as much consideration for different play styles and varying levels of comfort with VR mobility. It’s also the best-paced game I’ve played in VR; it’s the only title I’ve wanted to keep playing beyond my “oh, I don’t feel so good” threshold, which is somewhere around the 30-minute mark.
While the end goal of most of its encounters is to shoot bad guys and creatures with guns,Alyxoffers more open-endedness to encounters and to exploration in general. Once you clear a room, you can practice thwipping and throwing items with your gravity gloves, play the piano, or gawk at the stellar quality of theliquid shaders in bottlesbefore you smash them on the ground. You can open cabinets, fridges, and more, stacking each item you pull out realistically on top of the others. Why you would want to do that is beyond me (also, I did this), but the point is that youcoulddo it.Alyxput you in charge of how you spent your time in VR, not the other way around.
It’s trite to say this five years after launch, butHalf-Life: Alyxfelt like a door being kicked open, revealing what’s possible in VR. And, with the backing of one of gaming’s most beloved developers, I considered its release a possible turning point for VR tech going mainstream. I just really wanted everyone to be able to try it.
VR headset adoption has grown exponentially since 2020, thanks to Meta’s somewhat affordable Quest lineup of headsets. ThePlayStation VR 2can now be used on PCs, no longer exclusively tied to the PlayStation 5 (and it’s $200 less than it was at launch,costing $399.99). But since owning a powerful, costly gaming PC is the other part of the equation, that growth hasn’t made it all that much easier for more players to try games likeHalf-Life: Alyx. I wish Valve would port the game to PS5 so PSVR 2 owners could play it there. But since it hasn’t happened yet, more than two years after the headset’s launch, I’m not holding my breath. Maybe Valve is prepping a version of the game for its oft-rumored wire-free VR headset “Deckard” that our pals atThe Vergehave written about. Or maybe it’s not.
While there have been other great VR-only games sinceAlyx(Horizon Call of the Mountain, Assassin’s Creed Nexus VR, Batman: Arkham Shadow, to name a few that swung for the fences), the virtual reality segment has struggled to keep up the pace with new, must-play games. That’s sad, though it makes me treasureHalf-Life: Alyxeven more. It was a huge gamble to release the long-awaited prequel to one of the most influential games in virtual reality, requiring hardware that very few had then, and still very few have today. To that end, every developer making VR games is knowingly making a huge gamble that may not pan out in their favor.
Sure, I wish thatAlyx’s story could be played directly on consoles and PC so that more fans can play the game, but without gravity gloves, that would spoil all of the fun. When or if that’ll ever happen isn’t for us to decide. So, go ahead, do a stupid thing and buy a VR headset just so you can playHalf-Life: Alyx, even if you return it right after (I won’t tell). The game is just$17.99during the Steam Spring Sale, which lasts until March 20.
The best of Polygon in your inbox, every Friday."
How to enable (and disable) crossplay in Palworld,2025-03-19T15:16:30Z,https://www.polygon.com/palworld-guides/542592/crossplay-how-to-enable-disable,"PC and console players unite
byJohnny Yu
Crossplayin allows PC, PlayStation 5, and XboxPalworldplayers to playmultiplayertogether.
Players across platforms can progress through thetower bosseswith their Pals, but know enabling crossplay can be a little confusing for players who haven’t messed with their world settings before.
Crossplay was introduced as part of March 2025’s v0.50 update, which also added theGlobal Palboxand the ability tocustomize armor appearance.
Crossplay can be enabled in any world — whether it’s new or full ofbases. First, know only the player hosting the session will need to perform any actions. The joining player will not have to change any settings or perform any actions other than joining the world.
To enable or disable crossplay inPalworld:
With crossplay on, players across Xbox, PlayStation 5, and PC will finally be able to join each other’s sessions, visit each other’s bases, and show off your favorite Pals using theGlobal Palbox.

The best of Polygon in your inbox, every Friday."
Assassin’s Creed Shadows is a gorgeous retread of tired RPG mechanics,2025-03-18T17:04:02Z,https://www.polygon.com/review/541609/assassins-creed-shadows-review,"The historic setting is fascinating and impressive, and I’m still left wanting more
byGrant Stoner
A shinobi deftly runs across several rooftops after swiftly assassinating several guards. She opens a large castle gate for reinforcements. A hulking samurai walks through, leaving behind a trail of bodies. The two climb up the castle stairs before being greeted by four samurai. They unsheathe their swords, offering me a choice of which character to enter the duel with. Naoe steps forward, her hidden blade extended, ready to meet its target.
Assassin’s Creed Shadowstakes the series through the late Sengoku period of Japan, set roughly between the 1570s and 1600 C.E., during the time in which Oda Nobunaga attempted to unify the nation and Japan saw an increase in Portuguese traders and Jesuit missionaries. Much like the duality of the historical setting,Shadowsis always playing with multiple themes throughout its story. Revenge, heartbreak, and even a sense of belonging and purpose are present in every mission. The narrative ofShadowsis its best feature, one that kept me engaged throughout my 35-hour play session, and one that will continue to draw me in as I finish the campaign.
Shadowshas players swap between the two main characters — Naoe, the assassin, and Yasuke, the samurai — but only after the first 10 hours or so, when you unlock Yasuke. Naoe’s story sees her coming to terms with her background as a member of the Iga clan, coupled with her understanding of her role in the Brotherhood, the secretive era-traversing assassin guild. Her journeys throughout Japan reflect the vastness of the nation’s cultural and political landscape. She is fierce and deadly, assassinating high-profile samurai while simultaneously learning how to exist beyond the fields of her home.
In one of my favorite missions, Naoe discovered the art of chanoyu, a traditional Japanese tea ceremony. Players are required to fetch an ornate gift for the host of the ceremony, memorize proper cup placement when drinking, and even choose a formal kosode to wear. Every decision you make during this mission impacts your conversation with the others at the ceremony, the guests clearly discerning that Naoe is out of her element. She is so singularly focused on her goal of revenge that the intricacies of chanoyu fall to the wayside. And once she locates her target, she shifts out of her disguise and into her shinobi identity.
Yasuke is also quite literally the definition of an outsider. Arriving with the Jesuits, Yasuke quickly gains Nobunaga’s attention because of his race. Both true to the game and the historical figure, Yasuke was the first Black man in Japan, and the only Black man in history to achieve the rank of samurai. And his missions inShadowsreflect the duality of his life as a samurai and a foreigner. During a flashback in the game, Yasuke is sent to study under the same sensei that trained Nobunaga. Three students beat him and mock him for his large size and his inability to properly wield a sword. After training dutifully, he kills the three in a duel, winning the favor of Nobunaga and becoming one of his samurai and trusted advisers. And yet, he is still disrespected by several members of Nobunaga’s council for being an outsider.
Even the world ofShadowsfeeds into the themes of belonging. Naoe is all but ignored as she wanders through cities and villages. People pay no mind to her as she recruits companions to her cause or gathers information on targets. Her sense of place comes from trying to establish a new home with those equally impacted by the plight of war. Yasuke, on the other hand, is feared and revered as he travels. Random villagers will walk up to him and bow, or say his name in excited tones. One of my favorite things to do when discovering a new location was to swap between characters and compare the reactions of townsfolk. It brought the world to life, something that is often missing with protagonists in other Assassin’s Creed games. You’re always meant to be hidden, a nobody. But it’s disappointing to explore these prominent historical settings and not feel like you’re part of these moments.Shadowsrectifies that.
Unfortunately, my adoration withShadowsbegan to falter after the novelty of the story and the initial exploration elements wore off. At its core,Shadowsadheres to the same open-world role-playing game formula we’ve been exposed to sinceAssassin’s Creed Originsin 2017. Main missions and side objectives follow a predictable flow: Go to a general area in a region, locate intel or a person of interest, find and eliminate the target, then rinse and repeat. The gameplay loop is admittedly fun during the first 15 hours, as players are introduced to the differing ways in which Naoe and Yasuke play — Naoe as the traditional stealthy character in every Assassin’s Creed game, and Yasuke as a powerhouse that can overwhelm heavily armored opponents — but that novelty can’t mask the repetitive objectives. Even side storylines, which reveal themselves as you progress through the story and discover new regions, play out the same way as main missions.
I often felt forced to complete side quests just to level up and get better gear because I didn’t want to be underleveled. However, this meant exposing myself to theexactgameplay sequence I just spent hours completing. For example, each castle has a select number of daimyo (samurai) to eliminate before collecting legendary loot. And they look and play exactly the same at every single castle you visit. While some side quests beautifully weave in Japanese history and folklore, like the hunt for yokai (spirits from folklore), there is no deviation in the way they’re completed. The design and development choices feel far more invested in ensuring accurate Japanese historical and cultural representation than in weaving entertaining gameplay throughout. Learning about the culture and time period is definitely a plus, but the setting can only do so much to draw me in before I’m inevitably bored.
Even the exploration of Japan is repetitive. While I loved interacting with the environment and encountering wild animals to paint through sumi-e, finding new sensei to train my skills through kata, and navigating through kofun (tombs) and Hidden Trails, they don’t do enough to level up your character.
Activities like discovering lost scrolls in temples, praying at various shrines, and looting castles are all introduced within the first several hours, and nothing about them changes. If you successfully loot one castle, you’ve essentially looted them all. But because they have legendary gear, precious materials for upgrading your hideout, and large amounts of experience points as rewards, you’re expected to continuously loot them as you progress. This is by far my biggest complaint withShadows. The RPG elements force you to play through repetitive side missions just to level up and complete main missions. It was unique withOrigins, but roughly eight years later, I find myself longing for a traditional, relatively linear Assassin’s Creed game.
These issues are compounded with the game’s perplexing accessibility. Ubisoft is known to regularly champion accessible features and inclusive design practices with its games, andShadowsis no exception. With options like Guaranteed Assassination, audio cues for mechanics like traversal and combat, and Auto Movement,Shadowsis an example of what players have come to expect with modern accessible titles. Even the combat is inclusive through the simplistic and accessible design, allowing me to play for long hours. However, the limitations of customizable controls on Windows PC left me frustrated and physically exhausted.
While it’s possible to customize every input, even stacking actions on the same button or key, the remapped inputs don’t always register, and they occasionally override each other. With my limited reach, I can access approximately nine mouse buttons and keyboard keys. I often require games to let me bind actions to the same key, likeEscape from Tarkovdoes.Shadowsdoestechnicallyenable this, as my grappling hook and assassination are bound to the same key, as well as interact and swap weapons — but no other functions behave this way. I’ve tried combining other inputs to the same keys with little success, and I can’t discern why some combinations work and others don’t.
These difficulties force me to use a virtual keyboard to make up for the lack of available buttons and keys, but even the virtual keyboard doesn’t properly function within the game. With every click, the game registers me attacking first before applying the desired input. For example, pressing H lets me heal, but my character always swings their weapon before the heal is applied. This isn’t necessarily an issue during combat, but can be problematic when I’m trying to remain hidden in the bushes or on top of rooftops. This even affects aspects like changing equipment. You are unable to change equipment when performinganyaction, and to open my inventory, I need to press I with the virtual keyboard. The only way I can successfully change weapons or armor is by being in an area that locks the game out of combat, like in your hideout or on observation platforms. This forces me to either wait for a family member or friend to press the key, continue playing until I reach a new lookout spot, or fast-travel back to my hideout.
The virtual keyboard also impacts the act of summoning my mount. Since I need to click X to call my horse, the game always registers me attacking first. I have yet to properly ride a horseanywhere, forcing me to either fast-travel around the map or run to new locations, which can be thousands of meters away. I’ve added approximately three hours to my overall playtime just from running across the map, since I can’t access my horse. And while you can customize every key, every option I already have is crucial to playing the game, forcing me to leave some functions unavailable without the virtual keyboard.
Assassin’s Creed Shadowsexplores a setting I’ve wanted to explore for years. It’s always made sense to bring the series known for its hidden organizations and ninja-like aesthetics to feudal Japan. And while I thoroughly enjoyed my time with the setting and story, so much so that I will be rolling credits well after launch, it’s marred by open-world RPG mechanics that continue to plague modern Assassin’s Creed games with repetitiveness.
Assassin’s Creed Shadowswill be released March 20 on PlayStation 5, Windows PC, and Xbox Series X. The game was reviewed on PC using a pre-release download code provided by Ubisoft. Vox Media has affiliate partnerships. These do not influence editorial content, though Vox Media may earn commissions for products purchased via affiliate links. You can findadditional information about Polygon’s ethics policy here.
The best of Polygon in your inbox, every Friday."
