title,publishedAt,url,full_text
Indiana Jones and the Great Circle whips up PS5 release date,2025-03-24T15:01:29Z,https://www.polygon.com/news/544781/indiana-jones-great-circle-ps5-release-date,"Please enjoy Troy Baker whipping Nolan North
byMichael McWhertor
If you buy something from a Polygon link, Vox Media may earn a commission.See our ethics statement.
PlayStation 5 owners will finally get a chance to playIndiana Jones and The Great Circleon April 17, or April 15 in early access, developer MachineGames and publisher Bethesda Softworks confirmed Monday. The announcement comes with a great bit of comedy, as ubiquitous voice actors Nolan North and Troy Baker — whovoices Indy inThe Great Circle— discuss what it means to embody a video game adventurer in a new clip promoting the release date.
North, the famous voice behind the Uncharted series’ Nathan Drake, serves as something of a mentor to Baker in the video, enlightening his younger colleague about the weight of taking on the role of someone like Indiana Jones, or a character Indiana Jones-adjacent. And frankly, I’d like to see more from these caricatures. North’s pompous-ass version of himself is just as fun as Baker’s put-upon rendition.
Anyway, the news here is thatIndiana Jones and The Great Circleis finally coming to PS5 in April, just four months after the game’s release on Windows PC and Xbox Series X. While the official street date forThe Great Circleis April 17, pre-ordering the game will grant early access on PS5 starting April 15. Digital pre-orders are available now, with physical pre-orders opening March 25.
In addition to launching the PS5 version in April, MachineGames is adding two new whip abilities to all versions of the game: Open Season and Sleight of Hand. Open Season will inflict more damage to enemies on subsequent attacks if they’ve been cracked by Indy’s whip, while Sleight of Hand will let players disarm an enemy and cause their weapon to fly Indy’s way.
Indiana Jones and The Great Circleis an original adventure based on the character created by Steven Spielberg, George Lucas, and Harrison Ford. The story, set between the events ofRaiders of the Lost ArkandThe Last Crusade, sends Indy on a globetrotting mission as he battles Adolf Hitler’s forces, which are chasing artifacts of great power. Jones teams up with an Italian journalist named Gina Lombardi, who has a personal stake in their journey.
The latest game from the developer behind the modern Wolfenstein games was well-received late last year, andcould’ve been a GOTY contenderif not for its December release. OnMetacritic,The Great Circlehas “generally favorable” reviews, and onSteam, a “very positive” reception from players.
The best of Polygon in your inbox, every Friday."
You are Phil Spencer. Which Ubisoft IP do you buy?,2025-03-21T21:29:31Z,https://www.polygon.com/gaming/544628/ubisoft-ip-sale-microsoft-phil-spencer-not-assassins-creed,"Just a little one. As a treat
byOli Welsh
According toone very annoyed Ubisoft investor, citing a private report by investor service Mergermarket, Ubisoft has been holding secret talks with Microsoft, Electronic Arts, and other publishers who are interested in acquiring some of the troubled publisher’s franchises.
This is interesting in the context of Ubisoft’s current struggles; the floundering publisher hasn’t had a hit in a while, is losing the confidence of investors, and is “exploring strategic options” that include going private and breaking up the company. Thelatest reportssuggest Ubisoft is looking to create a new entity that will hold on to some core intellectual property. Things are so bad that even a stellar launch forAssassin’s Creed Shadowswon’t necessarily fix it all.
It’s also an interesting prompt for assessing the Ubisoft catalog. What properties does Ubisoft have that are worth buying, but that Ubisoft itself can do without? What can Ubisoft sell without throwing its soul into the bargain?
So, I propose a little thought exercise. You are Phil Spencer, CEO of Microsoft Gaming. You have spent many billions acquiring publishers like Bethesda and Activision Blizzard, and studios like Obsidian and Double Fine, in a seeming attempt to own all of gaming (if not to actually sell Xbox consoles). But you are not quite satiated yet, and the spectacle of a floundering French publisher conducting a yard sale of storied franchises is too tempting to resist. Maybe just a little one? As a treat?
What will you choose? For the purposes of this exercise, we’ll assume that Assassin’s Creed is not for sale; it’s Ubisoft’s flagship, and without it the publisher might as well just close up shop. To a lesser extent, the same goes for Far Cry. And we’ll also assume that all the Tom Clancy games are off the table. It’s true that some parts of the Clancyverse seem ripe for the picking — for example, Splinter Cell, a fondly remembered stealth action series (with strong links to Xbox) that Ubisoft is currently doing nothing with. But it seems unlikely that the Clancy estate would be interested in breaking these properties up — and there’s no way Ubisoft is letting go of Rainbow Six, which is one of its most reliable cash cows.
So, what’s left in the shop window to tempt a browsing Microsoft exec?
Well now. This one is quite tempting, isn’t it? A largely dormant action-adventure franchise, recently revived by a quality Metroidvania, but with a major reboot wallowing in development hell. You never really had anything to match Uncharted with. This could be it, maybe… although corporate might not like the optics of an American giant swooping in to acquire the most famous Middle Eastern gaming icon. Especially in… the current climate.
You never really had a platforming mascot to speak of, but this one is just soprofoundlyFrench it’s impossible to imagine it as a standard-bearer for the greenest, most American game console. Respectfully, it’s a hard pass.
The same ought to apply to Ubisoft’s funny little rabbit guys, but if you squint, they look an awful lot like Minions. And Minions arehugewith kids. Family franchises are a bit of a blind spot for Xbox. On the other hand, the only decent games the Rabbids have ever been in also starred Mario, and Furukawa-san over at Nintendo probably won’t be into it. (You need to call him, though, about putting every single one of your franchises on Switch 2 — it never hurts to ask!)
This is a multiplayer game you’ve never heard of about medieval warriors beating each other up. But there’s a note on the sticker that Ubisoft reckons it has35 million players? That can’t be right. Have your team pull the data on that one. Might be worth it, if it’s cheap. Who doesn’t like swords?
You actuallydohave Forza Horizon at home. So it’s a pass.
Oh man, you remember loving the original one on PlayStation. And didn’t they do that wacky one that was all about a ghost policeman possessing cars? That was cool. You have enough driving games, but this one’s a little bit different, a bit funky. Ask if they’ll throw it in with something else.
[You have a Kinect trauma flashback and curl up in a ball on the floor.]
You didn’t spend $7.5 billion acquiring The Elder Scrolls for nothing. Except, apparently you did, because the next one is never coming out, and Obsidian could probably churn out three Might and Magic games for you by next week. Still though… nah.
Somehow, despite buying half the game industry, you don’t really have any GTA-style open-world games, and to Ubi’s credit, Watch Dogs got quite good; you remember thinking the last one,Legion, was pretty fun. If theyreallywon’t let you have Assassin’s Creed (note to self: up offer by $0.5-1 billion), you could see yourself owning this. But then… it’s not actually GTA or Assassin’s Creed, is it? It’s not even Far Cry.
Nowyou’re talking. A franchise that was maybe never actually popular, but that has ascended into fanboy myth status. A directionless vaporware project that’s been stuck in development hell for somewhere between 10 and 20 years. But you couldsaveit, Phil. Think of the gamer cred! Think how cool your T-shirt reveal would be! It’s just so Xbox. It’s just soyou. Where’s Satya’s company card?

The best of Polygon in your inbox, every Friday."
"InZoi, Atomfall, and the other new games out this week",2025-03-21T21:04:54Z,https://www.polygon.com/gaming/542969/best-new-game-releases-march-24-inzoi-atomfall,"This week’s games are surprisingly uncanny
byTyler Colp
If you buy something from a Polygon link, Vox Media may earn a commission.See our ethics statement.
The new game releases this week are a little bizarre. Whether it’s taking a pretty grim concept and putting it into a cute aesthetic or literally stepping into dreams, these games are playing with surrealism. It helps that a lot of them are tied to familiar genres, because the places they go might be a little uncomfortable.
Spilled!is a colorful little game about cleaning up oil and plastic. It looks chill and inviting, but your job is to save the world from all the waste. Over inAtomfall, the world is already gone, ravaged by a nuclear disaster. There are bright green fields warped by irradiated fissures and melted buildings. The nightmares continue inKarma: The Dark World, a horror game where you solve crimes by hopping into the heads of the suspects. And at the end of the week,InZoiarrives with its uncanny characters and hyperrealistic cities. It may be a chill life sim, but it can’t escape feeling a little disturbing with howperfecteverything is.
Here are our most anticipated game releases for the week of March 24.
Release date:March 26Platforms:Mac, Windows PCThis is a game about cleaning up the ocean with your fancy boat. There are oil spills, discard plastic, and fires to take care of in each level, as well as some cute animals to save.
Release date:March 27Platforms:PlayStation 5, Windows PC, Xbox Series XIt’s that time again — Soulslike time. This game is a mix ofSekiroand other action RPGs, with tense combat and tons of weapons to wield. Unlike a lot of Soulslikes, however, it also has an easy difficulty option that makes it approachable for newcomers to the genre.
Release date:March 27Platforms:PlayStation 4, PlayStation 5, Windows PC, Xbox One, Xbox Series XWelcome to STALKER in the British countryside. This shooter is about surviving after a nuclear disaster. Everything is scarce all the time, forcing you to weigh your options when confronted with combat and even seemingly friendly NPCs.
Release date:March 27Platforms:PlayStation 5, Windows PCThis is a sci-fi game with Soulslike combat. You have a huge arsenal of weapons and spells to use against a bunch of otherworldly beasts. Don’t expect slow,Dark Souls-style combat in this one.
Release date:March 27Platforms:PlayStation 5, Windows PC, Xbox Series XThis game sounds like a mix of a detective game and a psychological horror game. The world is controlled by a big corporation, and you play as a detective who can step into the minds of suspects. I’m sure nothing scary will happen with that.
Release date:March 28Platforms:Windows PC (early access)Here’s a life sim with a hyperrealistic look. You create a character and then pick a city to live in. From there, it’s your job to customize the city with food trucks and parks to keep everyone happy. The game is launching in early access, so expect a bunch of updates as time goes on.
The best of Polygon in your inbox, every Friday."
How to play offline single-player in Monster Hunter Wilds,2025-03-21T17:44:48Z,https://www.polygon.com/monster-hunter-wilds-guide/542541/how-to-play-offline-single-player,"Sometimes you need a break from all the randos
byAna Diaz
If you have an internet connection and the right subscriptions,Monster Hunter Wildsallows you to play in a lobby with a whole bunch of other people online. But sometimes you just want to playoffline single-player.
For some, an online lobby can be super helpful. Stronger players can swoop in and help you defeat tough monsters and give you the support you need. However, that’s not always the experience a hunter wants, and many might prefer to take on each challenge by themselves.
This guide will show you how to play both online and offline single-player inMonster Hunter Wilds.
Before we get into all the ways to play offline, there is technically a way you can stay “online” but continue the game in a single-player.
To do so, go and find Alma, the character who manages the quest counter. (Finding her shouldn’t be too hard since she accompanies you almost everywhere in between assignments — however, you can also find her in any basecamp. She often sits by your tent in at each basecamp.)
Talk to her to access the Quest Counter and tab over to the “Change Lobby Menu” page. Once there, select the option, “Online Single Player” the setting will alter the game so you continue your adventure in single-player. If you play in this mode, other players will only be able to join you for the duration of the quest you’re on. (If you don’t fire an SOS flare, you will never see another player in this mode.)
For more information on how to play with other people, check out our onlinemultiplayerguide.
There is one sure way to make sure you playMonster Hunter Wildsoffline:Disconnect your console or PC from the internet.
If you’re using a PC, you can either unplug your ethernet cable or turn Wi-Fi off under “Network & Internet” in the system settings. But here’s how to do so on consoles.
For PlayStation 5:
For Xbox Series X:
OurMonster Hunter Wildsguides can outline your progress with ourmain story walkthroughandmonster listahead of reachingHigh Rank, help you settle on an armament with ourweapons listandbest weaponsexplainers, uncoverores,bones, andmonster tails, and teach you how tojoin friends in co-op multiplayer.
The best of Polygon in your inbox, every Friday."
Future Games Show trailer reopens the story of banger horror comic I Hate This Place,2025-03-21T17:13:36Z,https://www.polygon.com/trailer/544255/i-hate-this-place-horror-game-comic-adaptation,"Its original title was ‘F*ck This Place’
bySusana Polo
If you buy something from a Polygon link, Vox Media may earn a commission.See our ethics statement.
I Hate This Place, the 2022 horror series from writer Kyle Starks and artist Artyom Toplin, wasone of my favorite comicsthat year. And now, as revealed in the Future Games Show, it’s a neon-colored isometric open-world survival horror game that I’ll probably be too chicken to play.
I Hate This Place— originally announced asFuck This Place, which is a way better title, but, like, I get it — starred Gabby and Trudy, a lesbian couple who see the cattle ranch they just inherited as their ticket to financial stability. Unfortunately, the family ranch is secretly a locus for every horror genre simultaneously: hauntings, alien abductions, a Strange Entity in the Forest, Secret Knife Killer Hiding Among You, the Place Won’t Let You Leave, Survivalist Cult Apocalypse, and so on.I Hate This Placewas kind of like… “Fast Car” meetsThe Cabin in the Woods.
The new game adaptation is being developed by Bloober Team (2019’sBlair Witch,The Medium), under the company’s new horror imprint Broken Mirror Games, and appears to focus on an original story set in the comic’s titular Place, potentially a prequel. “Players take on the role of Elena, whose fight for survival begins when she unwittingly awakens a malevolent force,” says a joint news release from Bloober Team andI Hate This Place(the comic)’s Skybound Entertainment. The game will feature “retro ‘80s comic book aesthetics,” where the original comic was set in the modern day.
“Each location is lovingly crafted to tell its own disturbing story through stylish visuals that blur the line between reality and nightmare in a world where everything wants you dead.” According to the news release, gameplay will feature “tense gunfights and melee combat that rewards ingenuity over brute force, all while crafting essential tools to survive the harsh and unforgiving wilderness long enough to reach safehouses before nightfall, with the day & night cycle having an impact on gameplay dynamics.”
I Hate This Placeis currently set to launch in Q4 of 2025, for PC, PlayStation 5, Xbox Series X, and Nintendo Switch. It’s available to wishlist onSteamand theEpic Games Store, and you could pick up the comic that inspired it onAmazon,Bookshop, or at your local store.
The best of Polygon in your inbox, every Friday."
Is Steam coming to Xbox?,2025-03-21T13:22:24Z,https://www.polygon.com/analysis/544182/steam-xbox-integration,"A leaked image suggests Steam is coming to the Xbox PC app — and maybe consoles, too
byOli Welsh
Microsoft seems intent on tearing down the norms of game-industry competition between platforms. Not content with publishingprecious first-party games on rival consoles, it now looks as though Xbox is ready to link arms with the leading PC gaming platform, Steam.
The Verge reportsthat Microsoft briefly published an image on Thursday depicting a new, cross-device user interface for Xbox. A filter for “Steam” is clearly visible in the view of a user’s game library shown in the image.
The image was published in a blog titled “Opening a Billion Doors with Xbox” about Microsoft’s currentplatform-agnostic strategy. (Sample quote: “Our goal is simple: to make every screen in the world an Xbox.”) The image was apparently quickly removed by Microsoft after The Verge inquired about it.
The publication of the image seems to have been a mistake. Does it really indicate that Steam integration is coming to Xbox? And, in a world where every screen is an Xbox, what does that mean exactly?
It’s certainly not outlandish that Microsoft might seek to make users’ Steam libraries visible within the Xbox PC app in this way. The Verge’s sources said that Microsoft plans to make every game installed on a PC visible within the Xbox app, and other PC game launchers, like GOG, do this.
But there’s also a real chance that Microsoft is thinking of expanding Steam integration beyond desktop PCs. The image shows the new Xbox UI running on multiple devices: a laptop, a phone, a tablet, and an Asus ROG Ally handheld, as well as a TV. Xbox consoles are also pictured. This is consistent with Microsoft’s announced strategy tocombine Windows and Xbox experiencesin a new, unified UI that will reportedly feature on anXbox-branded PC handheld from a partner manufactureras early as this year.
Could Steam integration come to future Xbox consoles as well as desktop and handheld PCs? It’s far from fanciful to suggest it. Xbox chiefPhil Spencer told Polygon last yearthat he thinks console platforms should be more open, like PCs, and that he’s open to putting rival storefronts like the Epic Games Store — or, it follows, Steam — on Xbox consoles.
Windows Centralrefers to persistent rumors of a partnership between Microsoft and Valve to put Steam on the next generation of Xbox consoles — rumors that Polygon has also heard (but not verified). The next-gen Xbox consoles — a dedicated handheld, and a successor to the Xbox Series X — aresaid to be more PC-like devices, running on a Windows-based development environment.
Considering all that, it’s surprisingly easy to picture Steam as an integral part of Xbox in future. This latest image is likely a mock-up, and its publication was surely an unintended slip. But that doesn’t mean it’s not a sign of things to come.
The best of Polygon in your inbox, every Friday."
Silent Hill 2 remake devs’ new horror game might scratch that Dead Space itch,2025-03-20T21:47:26Z,https://www.polygon.com/news/543865/bloober-team-cronos-new-dawn-survival-horror,"Bloober Team’s Cronos: The New Dawn looks scary good
byMichael McWhertor
After Bloober Team’s excellentSilent Hill 2remake, I’m willing to give the developer the benefit of the doubt when it comes to its brand of horror games. It certainly helps that its next effort,Cronos: The New Dawn, looks incredible and is giving off goryDead Spacevibes.
Cronos: The New Dawnco-directors Wojciech Piejko and Jacek Zięba make their inspirations pretty explicit in a new look at the sci-fi survival horror game.Cronosdraws on John Carpenter’sThe Thing, German TV seriesDark, and Terry Gilliam’s12 Monkeysfor inspiration, the duo say, as well as games likeDead SpaceandDark Souls.Cronosshares some familiar attributes fromDead Space, including terrifying human mutations as enemies, an over-the-shoulder shooting perspective, and a limb-severing mechanic — though Piejko says Bloober Team is taking a different approach to dismemberment than Visceral Games did.
In a follow-up to acinematic reveal trailer forCronos: The New Dawnreleased last October, Piejko and Zięba showed off some gameplay in a new dev diary Bloober Team released Thursday. The pair explain how protagonist the Traveller, who they liken to a deep-sea diver who plunges into the depths of time, is sent into the ruins of human civilization to extract survivors. The alternate-reality world ofCronoshas been ravaged by an event called the Change, which in the game’s fiction, destroyed our world in the 1980s.
Piejko and Zięba previously worked on Bloober Team’sObserverandThe Medium, so they have plenty of experience with sci-fi and psychological horror.Cronos: The New Dawnis an original property for Bloober, which is also working on a follow-up with Konami.
Cronos: The New Dawnis coming to PlayStation 5, Windows PC, and Xbox Series X sometime in 2025. It’s a welcome new entry in the AAA sci-fi survival horror space, especially since theDead Spaceremake team is now working on the next Battlefield and EA’s Iron Man game.
The best of Polygon in your inbox, every Friday."
