title,publishedAt,url,full_text
Blue Prince is a mystery-packed mansion that will crank open your mind,2025-04-04T22:17:07Z,https://www.polygon.com/review/553730/blue-prince-review-pc,"No two rooms at Mt. Holly are the same — nor do they even stay in the same place
byJay Castello
The house at Mt. Holly has 45 rooms. But the placement of each of those rooms is up to you — and it resets every day. You’ve been left the house and its estate as an inheritance, but only if you can find the mysterious 46throom.
In this way,Blue Princeblends its puzzles with both deck-building and roguelite elements. When you open the entrance hall door at the start of every morning, you’ll be given a choice of three rooms that might lie beyond it. Each of them has a fixed number and orientation of doors, limiting your path through the house, and each room has its own small bonus — or, in some cases, a drawback.
You might, for instance, draw the bedroom, and get rewarded with 10 additional steps to use throughout the day. Or you might draw the weight room, and lose half of your carefully scrounged footsteps. (The game’s step counter is a limitation on your movement; you can’t walk forever through the house, and if you run out of steps, you’ll have to come back the next day and start from scratch.) Or you might draw the parlor and have to solve a truth-and-lie logic puzzle to get gems, which you can spend on drafting more useful rooms later. Or you might find the nook, which always has a key; keys become increasingly necessary as you progress, since doors become more likely to be locked.
And then, packed in everywhere and anywhere, there’s the intrigue. In one early run, I opened a chest to find the “Key to the Secret Garden,” which warned me that it would not be an easy room to locate. It wasn’t until much later that I got access to the orchard, which explained how and where I could get access to said garden. But then I had to wait to run into the key again. That wait could have been a drag, except that (at least in the game’s first 10 or so hours) I was juggling dozens of these small cause-and-effect bits of progress at once, so there was always something to make me feel like I was moving forward.
This gradual accumulation of knowledge is almost the whole ofBlue Prince(one early room recommends having a notebook at hand; I filled several pages), although there are some architectural elements of the house that become permanent, making future runs more likely to be fruitful. These moments tend to feel big, some of them even having very atmospheric cutscenes that break up the routine of drafting door after door. You’ll also be collecting passwords and codes that stay the same across runs. Mainly, every new draft is a question of what you will learn about the estate and how you will apply that knowledge in future runs.
Spending run after run in the house gives you a lot of time to appreciate just how finely it’s built. Every room has a different walking sound to reflect the kind of flooring it has, for example. There are moments when the creeping dread of being alone in a shape-shifting house suddenly cuts through, momentarily but completely changing the atmosphere. And there are dozens of architectural details and notes and bits of clutter that all go into building up an idea of the history that once went on between these old walls.
With so many details hidden in every room, though, it’s important to bear in mind that the house also holds many, many mysteries that go much beyond your inheritance. After a while, discoveries that didn’t lead to something useful for the specific goal of finding the 46th room sometimes started to feel like disappointments, until I rolled around to the other side and started to appreciate just how much more is going on in this mysterious mansion. Being open to these grander puzzles, and accepting that solving one big question is only a sliver of what the game has to offer, made it much less frustrating.
Having said that, that willingness to be open is sometimes difficult to maintain when you run into a string of bad luck. Unless you are enlightenment-levels of willing to accept everything the game has to throw at you, sometimes you really will want to do a few runs just looking for something specific, which is never guaranteed. And unfortunately, the first several minutes of every attempt do end up feeling very samey, as the game doesn’t usually start offering more interesting rooms until you’re some way into the house. Some rooms are also just straight-up annoying. There’s a math-based puzzle that I hated every time, and it becomes harder and harder as you do more and more runs — but it’s very punishing to skip it because it grants keys, which are extremely valuable.
Because of friction like this, I think thatBlue Princeis going to live on the strength of its community. There came a point where repeating runs was not getting me anywhere, and every time, I would dread having to spend 10 or so minutes going through the motions again before getting a chance of seeing something new. (Or at least, something new that was going to make me feel like I was actually progressing toward a goal that I was interested in.) It turned out that I had missed something I could interact with in a room that I had previously written off as useless, which I only found out by talking to other people who were playing. Figuring that out had me rolling credits within a couple of hours — and more importantly, those couple of hours completely recaptured the enthusiasm and sense of discovery I’d had in the early game.
Seeding those kinds of hints without spoilers isn’t easy, but I do expectBlue Princeto grow the kind of fan base that can pull it off. It’s good now, but that will make it even better.
Blue Princewill be released April 10 on PlayStation 5, Windows PC, and Xbox Series X. The game was reviewed on PC using a prerelease download code provided by Raw Fury. Vox Media has affiliate partnerships. These do not influence editorial content, though Vox Media may earn commissions for products purchased via affiliate links. You can findadditional information about Polygon’s ethics policy here.
The best of Polygon in your inbox, every Friday."
Are PC handhelds like Steam Deck really competitors for Switch 2?,2025-04-04T21:19:21Z,https://www.polygon.com/nintendo-switch-2/553131/pc-handhelds-steam-deck-vs-switch-2,"They compete closely on price and specs, but Nintendo still owns the mass market
byOli Welsh
When Nintendo launched the Switch in 2017, it had no competition in dedicated handheld gaming, a sector it had established with the Game Boy in 1989 and ruled ever since. Sega had come and gone; Sony, after two determined attempts with the PlayStation Portable and PlayStation Vita, had just about given up.
As Switch 2 nears launch in 2025, things look a little different — but only a little. The colossal success of the Switch has awoken the slumbering giants. Sony and Microsoft are now reportedly preparingdedicated PlayStationandXbox handhelds. Improbably, though, it was the PC gaming sphere that made the first move. Valve led the way with the Steam Deck in 2022, which swiftly seeded a growing ecosystem of similar, PC-based handheld devices from manufacturers like Lenovo and Asus. After a quiet decade, non-Nintendo handheld gaming is a thing again. And that means the Switch 2 will not run unopposed for handheld gaming supremacy.
In a sense, Nintendo is the victim of its own strategic foresight. With the Switch, it was the first to spot that the narrowing gap in processing power between mobile and at-home devices had enabled a unification of handheld and home gaming experiences. Finally, the same games could work in both contexts. The Switch proved this point emphatically, and now everyone wants a piece.
But with dedicated devices from Sony and Microsoft still years away, for now that competition must come from Steam Deck and the other PC handhelds. My colleague Chris Plante persuasively argued that these devices representNintendo’s “biggest threat in the present.”They trounce the Switch on specs and have closed the gap to contemporary AAA gaming in the home until it’s almost imperceptible. Software-wise, they offer the compelling value and staggering range of just about everything on Steam — and much of PC gaming beyond it, if you’re prepared to fiddle about a bit.
It’s true that the Switch 2’s price and specs put it into direct competition with the lower-end PC handhelds. At $449, it’s $50 more expensive than the base model Steam Deck. The Switch 2 isroughly comparable in power and storage, has a much better screen, and with detachable controllers and a TV dock included in the price, it’s much more flexible to use. The base model of Asus’ ROG Ally handheld ($499 or thereabouts) and the new Lenovo Legion Go S ($549) are also pretty close competitors in terms of specs.
In raw hardware terms, these are all very similar devices. It’s worth noting that the Switch 2’sexclusive accesstoNvidia’s market-leading DLSS upscaling technologyshould allow it to punch a bit above its weight class. But realistically, there’s not much between them.
But — and it’s a very, very big but — comparing the Switch 2 to the PC handhelds by running your finger down a spec sheet, or by noting that they can all playCivilization 7andElden Ring, does not tell the whole story. Within an enthusiast bubble, PC handhelds are a big deal, but they do not exist in the same universe as Nintendo consoles. To put it bluntly, PC handhelds are still niche.
The Steam Deck has been a big success for Valve, but let’s put it in perspective. Valve has not discussed sales numbers, but market research estimates thatit has sold around 4 million Steam Decks. And Steam Deck dwarfs its competition; the same research suggests that, in total, around 6 million PC handhelds have been sold in the three years since the Steam Deck went on the market. Worryingly, there aren’t yet signs of strong growth in sales.
Stack that up against the Switch’s 150 million units sold and the wild difference in scale becomes evident. Of course, it isn’t a directly analogous comparison. PC handhelds have only existed for three years; the Switch has been around for eight years, and Nintendo has been in the handhelds business for more than 35 years. All the same, Nintendo predicts it will sell11 million units of the aging Switchin its current fiscal year — more than five times the predicted sales of PC handhelds in that time. Meanwhile, analysts reckon that theSwitch 2 will, on its own, outstrip the size of the PC handheld marketalmost immediately, with 6 to 8 million units available at launch, and up to 20 million sales in its first year.
Valve is a big player in the game industry, and a very rich company. But it is a newcomer to the world of consumer electronics retail, and it has a lot of catching up to do — if it’s even interested in doing it. Steam Deck isn’t available to purchase in stores; you can’t walk into Walmart and pick one up. Valve is not buying ads for it on TV or at bus stops. Companies like Lenovo and Asus have more traditional distribution channels, but they’re tiny minnows compared to the marketing, retail, and distribution might of Nintendo.
There are other factors that make the PC handhelds niche products. The user experience of Windows-based handhelds like the ROG Ally and Legion Go is notoriously bad. Valve’s SteamOS is much better, but it is still quite far removed from the reliability and simplicity offered by Nintendo and the other console platforms.
You cannot unbox a new Steam Deck, turn it on, and play a game straight away. It requires tinkering to get the best out of. Although Valve’s verification system for games is a helpful guide, it’s not guaranteed you’ll get a good, playable experience on every game. The Deck is also bulky and heavy. You would never buy one for a child, or share one within a family — it’s clearly not designed to be shared. Realistically, it remains a tough sell for anyone who isn’t a gaming hobbyist.
There is, reportedly, one upcoming device that may be able to change this narrative a little. Microsoft is said to be working with a PC handheld manufacturer ona system that will have Xbox brandingand a user interface based on a new version of the Xbox PC app. This has the potential to be a more user-friendly device that offers easy access to PC Game Pass on the go, which would be quite compelling. But, although Microsoft has now been making Xbox consoles for over 20 years, it hasconsistently struggledto use that experience to make PC gaming more seamless, despite repeated attempts — and the device doesn’t sound like much more than a stopgap until Microsoft’s own dedicated handheld console is ready.
Nintendo will not have true competition in handhelds until its peers in the console space get involved. Microsoft is reportedly eyeing 2027 for the release of its handheld Xbox. Sony’s portable PS5 is also said to be years away, if it’s ever released. Things are definitely heating up for Nintendo, and by the end (or even the middle) of the Switch 2’s life, the handheld gaming market is sure to be much busier than it is now. But for the next few years, competition for the new console will remain distant — at best.
The best of Polygon in your inbox, every Friday."
Disney Villains Cursed Café is the Modern AU of my dreams,2025-04-04T21:15:29Z,https://www.polygon.com/review/552799/disney-villains-cursed-cafe-review,"Am I enabling the Disney villains in their modern evil schemes? Maybe, maybe so
byPetrana Radulovic
I did something horrible. I told Jafar, the scheming vizier villain in Disney’sAladdin, about cryptocurrency, and now he’s determined to get WyshCoin off the ground by selling the luxurious lifestyle associated with the brand. The problem is he’s actually broke, so I need to brew him teleportation potion after teleportation potion so he can sneak into increasingly extravagant venues in order to sell the illusion of the WyshCoin lifestyle.
That’s just a day in the life of a potionista (a portmanteau of potion maker and barista) at the Cursed Café, the coffee shop at the center ofDisney Villains Cursed Café. The game is a partnership between Disney Studios and indie team Bloom Digital Media. InDisney Villains Cursed Café, I spend time brewing potions, talking to my villainous clientele and helping them achieve their goals (or sometimes, very specificallynothelping them). It’s a modern setting, which means the villains all have fun, contemporary designs — and contemporary problems.
Yes, Jafar’s setting up a cryptocurrency, and Snow White’s Evil Queen is running her own pyramid scheme. Meanwhile, Gaston is trying to impress his new golf bros at the country club he just joined. It’s hilarious to see what sorts of villainous shenanigans these iconic characters get up to in a modern, low-stakes setting. They’re taking over the world… in their own ways. And hey, in the year 2025, that does mean having huge social media followings!
The writing is sharp and funny, with some particularly pointed dialogue options (you can tell the villains that in this modern world, the rulers are the 1%, for instance). Seeing the characters interact is also a highlight. Cruella and the Evil Queen roll their eyes at Gaston’s attempts at dating on “the apps.” Maleficent and Ursula reluctantly team up for a social media collaboration. And throughout it all, the art style is incredibly charming, an elevated rendering of the characters’ Disney movie counterparts with some painterly accents.
With each in-game day, I have three chances to serve customers. Most of the time, this means picking between two villains to serve. But don’t worry — if it’s Cruella and Jafar at the counter and I pick Jafar, the rest of Cruella’s storyline will still unfold. The brewing mechanic is pretty straightforward; I just look at the recipe list to find the requested potion and then select the ingredients in my cupboards.
Occasionally, the villains will have bigger requests, and taking those on will continue the next big chapters of their plots. They’ll present me with their desired potion, often something malevolent and more complicated. My handy potion book will suggest a “good” option as well: It’ll have the same outcome, but probably result in less property damage. If you want to try a different option — or if you accidentally add the wrong ingredients — you’ll have the choice at the end of the day to buy a re-do from Yzma. The branching is simple, but enjoyable.
There is also an overarching mystery about the previous owner of the café that continues to perplex me — and is surprisingly complicated to figure out. One time, after I had messed up a day and intended to redo it, Yzma handed me a key that unlocked a secret room that held clues about this mysterious owner. But since I had fumbled the Evil Queen’s storyline, I erased the memories of that day to try again. The second time, though, I didn’t get the key — and a few in-game days later, I still haven’t! I’m not sure what conditions trigger more information about this storyline, but I’m determined to keep selling potions to find out.
But even if I’m still struggling at figuring out the grander mystery of the Cursed Café, I’m invested in the storylines of my customers. Even if I’m notactuallyinvesting in WyshCoin, every time I see Jafar at the counter, I eagerly select him to serve because I just want to know what the heck he’s scheming next. Maybe I’m tapping into my own inner villain by enabling him, but hey, you don’t become the favorite potion brewer of some of the best Disney villains by playing hero.
Disney Villains Cursed Caféwas released March 27 onNintendo Switch, PlayStation 5, Xbox Series X, and Windows PC. The game was reviewed on Nintendo Switch using a download code provided by Disney Games. Vox Media has affiliate partnerships. These do not influence editorial content, though Vox Media may earn commissions for products purchased via affiliate links. You can findadditional information about Polygon’s ethics policy here.
The best of Polygon in your inbox, every Friday."
