title,publishedAt,url,full_text
Atomfall is an achievement in cutting to the chase,2025-03-28T21:43:40Z,https://www.polygon.com/opinion/548988/atomfall-opening-rebellion-pc-xbox-ps5,"Rebellion’s stealth game demands you walk boldly out into the unknown
byMatt Patches
Rebellion’s stealth game demands you walk boldly out into the unknown
byMatt Patches
Forget the number of hours it takes for a game to “get good” — how am I spending the first15 minutes?
Call me impatient, but a game’s opening seconds, even those introductory moments as a character comes alive or a world opens up, are make-or-break for how far I am willing to soldier on into what could be 20, 30, or 100 hours of play. So what a relief it was to fire upAtomfall, the new stealth-driven survival adventure from Sniper Elite developer Rebellion now on PlayStation, PC, and Xbox (via Game Pass), and feel immediately dunked into its radioactive mystery.
Atomfalltakes place in an alt-universe patch of northwestern Englandwhere a nuclear disaster has left buildings crumbled and society torn apart. There are paramilitaries operating walled-off towns and pagan cults stalking the open fields. A dash of retrofuture machinery gives the backdrop a Fallout flavor (intentional), while the mannerisms and encounters are delightfully British (“press X to pour tea”). There’s lots to discover, and enough jank to the physics to build an aura of danger — in “the zone,” you’re in the wild.
None of this is spelled out when your first-person avatar wakes up confused, underground, and faced with a decision to help or hurt an ailing doctor who dangles the first of the game’s many mysteries in front of you. You grab a backpack and a few supplies and rush out the door into the devastated but sunny Cumberland countryside, with only a few breadcrumbs scattered to let you know where to go next. My first time booting upAtomfallwas at 11 p.m. on a weary Wednesday night; I was terrified by the stillness of the land and thrilled to decide in which direction to run. For all its Fallout andSTALKERconnections,Mystcame to mind more than once.
Not too long before jumping intoAtomfall, I trudged through the opening hours ofAssassin’s Creed Shadows, the definition of the AAA open-world experience that offers so much at the end of the tunnel.A long, long, long tunnel. Dozens of foundational cutscenes aside, my initial time withShadowsfelt like booking a trip to Disney World then immediately beelining to the monorail. Even the tutorial-fueled cold open ofShadows, which finds up-and-coming samurai Yasuke plowing through baddies, felt so on rails as to grind my interest to a halt. Not every game needs a mystery to propel it forward (thoughShadowskinda has one), and I welcome a guided tutorial to intricate systems that will soon replace family birthdays and login passwords in my memory. ButShadows’ first two hours of play lacked the flicker of immediacy. After I adjust brightness and calibrate controls and shuffle through character creation options, I want to accomplish something right away — something more than just pressing buttons.
Instead of a preface laying out the whos and whats and wheres,Atomfall’s opening demands investigation. At first, the only clues are in the scenery — an ethereal light beaming from behind nuclear cooling towers, scintillating against the moorland like the Shimmer inAnnihilation— and a few hints from the doctor that suggest a direction. Typical on-screen prompts explain crafting, combat, and stealth, but knowing how the systems work inAtomfallrequires some experimentation. What’s worth making room for in your inventory? Live a little, and you’ll figure it out. How do you survive a spat with a local outlaw? Pray to god the cricket bat you just picked up is a decent weapon. How do you successfully trespass through a military encampment without tipping off the guards? That streammightmuffle your steps. Maybe.
Atomfall’s investigations leave a similar curiosity gap, relying on clues and coordinates to get you to the next milestone moment instead of obvious map landmarks. It’s not anotebook game, but I felt in total control of where my detective brain wanted to go next — or didn’t. There are a number of bunkers and other dimly lit death traps scattered around the hills of the radiation zone, and early on, when I felt bold enough to flick on my torch (or as the non-Brits say, flashlight), I descended down to ultimately meet my demise. The nuclear fallout has not been kind to every local.
I have many more hours to go inAtomfall, but it’s a relief that it didn’t take even an hour to feel absorbed by Rebellion’s pitch. The setup kicked me out the door. The gameplay dropped me into the unknown. Without a clue, I started walking. Having broken into a mine haunted by shadowy figures, hit the gate of a compound that may unlock the secrets of this disaster, met a vicar who begged me to keep a discovered murder a secret… I want to keep digging.
Rebellion is right to say thatAtomfallis“AA punching up.”The game is modest in size, but the scope seems to have created greater urgency in the pacing. Games of much smaller scale — a retro platformer, a pixel life sim — also ask you to hit start and learn as you go. There are AAA games with similar immediacy (Baldur’s Gate 3comes to mind), but many more that prioritize graphical polish and the vastness of their mechanics before getting around to the reason we all showed up.
Atomfalllands between the two for me, thanks to genre and a simple bit of cinema logic: show, don’t tell. If you see a door, you’ll run to it. Then you’ll keep running. You’ll figure out the rest — or die trying.
Atomfallis out now on PlayStation 4, PlayStation 5, Windows PC, Xbox One, and Xbox Series X.
The best of Polygon in your inbox, every Friday."
The Last of Us Part 2 Remastered on PC and the other new games out this week,2025-03-28T21:09:39Z,https://www.polygon.com/gaming/546675/best-new-games-releases-march-31-last-of-us-part-2-remastered,"This week’s games balance horror and joy
byTyler Colp
If you buy something from a Polygon link, Vox Media may earn a commission.See our ethics statement.
The new game releases this week waver between horrifying and charming. Sometimes the premise of a game is pretty sad on its face, but the stuff you do isn’t as bleak. That’s the case for a couple games arriving this week. However, that’s not true forThe Last of Us Part 2 Remastered, a game fully committed to misery. There are cheerful moments in it, though, so it technically counts. Just don’t go into it expecting to spend 40 hours riffing on Ellie’s guitar.
Koiradrops just before the rest of the games on the list arrive on Thursday. It’s a game about exploring a forest with a lost puppy, and if I think too hard about where that story might go I’ll cry. Then there’s Naughty Dog’s bleak, post-apocalyptic shooter where you can’t go 45 minutes without watching something awful happen.Sandalso comes out on that day and brings a fun twist to the extraction shooter genre: spider tanks. AndCaligoandSephiriaare two games that look more pleasant than they actually are. One of them lets you play as a bunny warrior, though.
Here are our most anticipated game releases for the week of March 31.
Release date:April 1Platforms:PlayStation 5, Windows PCThis little adventure game is for dog lovers. Your character finds a puppy and goes on an adventure in a magical, musical forest. It’s like a single-player co-op game as you solve puzzles and work together to find home.
Release date:April 3Platforms:PlayStation 5, Windows PCJust in time for theHBO show’s second season,The Last of Us Part 2is finally coming to PC. This version will have improved graphics, the No Return roguelike mode, and a whole developer commentary mode to learn how the game was made.
Release date:April 3Platforms:Windows PCMuch likeRust,Sandis another survival game with a straightforward title. OK, it’s more than that: It’s also an extraction shooter where everyone drives weird spider tanks. Basically, the game looks like Mad Max with rocket launchers.
Release date:April 3Platforms:Nintendo Switch, PlayStation 5, Windows PC, Xbox Series XThis dreamlike walking simulator is coming to consoles this week. This game has a variety of places to explore, like pretty fantasy forests and hellish nightmare worlds. This is a game full of surprises.
Release date:April 3Platforms:Windows PCYou’re a bunny in a pixel world of animals, artifacts, and roguelike action. This early access game is all about finding gear and equipping yourself to protect the other animals of the land. And even though it’s not finished yet, it already has four levels and over 250 items to find.
The best of Polygon in your inbox, every Friday."
The big questions going into the Switch 2 reveal,2025-03-28T18:30:59Z,https://www.polygon.com/analysis/548500/nintendo-switch-2-questions-before-reveal,"Nintendo’s full reveal will hopefully answer all of these unknowns
byMichael McWhertor
This story was first published in Switchboard, a newsletter from Polygon that delivers all the latest Switch 2 news, reporting, and rumors directly to your inbox.Sign up hereto get it weekly.
This time next week, we’ll know a lot more about theNintendo Switch 2. A newNintendo Direct showcasededicated to the top-secret handheld console will air on the morning of Wednesday, April 2. That presentation will offer a first look at new games, hardware details, and hopefully much more.
Ahead of the event, we have a long list of questions that Nintendo still needs to answer. Here are some of the biggest unknowns about Switch 2.
Some of the biggest questions we’re hoping will be addressed during the Nintendo Direct surround the new Joy-Con controllers. Will they have Hall effect joysticks, as previously reported? And does that mean stick drift is a thing of the past?
How will the rumoredmouse control features of the Joy-Conswork? More crucially, do Joy-Cons actually feel good as mice? Are players going to need a dedicated mousing surface, or will a coffee tabletop or couch surface suffice?
Importantly, how do the new, larger Joy-Cons feel in the hand? Will those bigger shoulder buttons work as well as we’d hoped? And what does thatnew “C” button on the right Joy-Condo?
The Switch’s Joy-Cons were a pretty radical reinvention for game controllers, both revolutionary and quite flawed. That’s why the full reveal of the Joy-Con (2.0) controllers will be so fascinating to watch, to see how Nintendo moves its design forward and fixes the original version’s shortcomings.
Officially, we only know of one Nintendo-developed game coming to Switch 2 at this point: a new Mario Kart game. But Nintendo has reportedly been building up a strong library of internally developed Switch 2 games, and while we have some ideas about which dev teams could be working on which franchises, Nintendo is excellent at keeping secrets and delivering surprises.
Arecurrent-gen Switch games being developed with Switch 2 in mind, meaning will they support higher resolutions and improved frame rates? (Xenoblade Chronicles X: Definitive Editionmay have already answered this question.)
Frankly, I think we’re all wondering which Nintendo franchises will show up during the Switch 2’s first year. Will Nintendo have a new 2D or 3D Mario ready for launch?
Beyond franchises, perhaps the most exciting thing yet to be revealed is the Switch 2’s equivalent ofWii Sports,Nintendo Land, and1-2-Switch— a game or games that will show what the new system is capable of and what differentiates it from the original Switch.
Which third parties will show up for Switch 2? And how strongly? Both Microsoft and Ubisoft seem ready to step in and support Switch 2 with a long line of AAA games that couldn’t fit on a Switch, but seem like a perfect fit for Switch 2.
Microsoft has publicly voiced interest in Switch 2, meaning franchises like Halo, Call of Duty, Forza, and Fallout could make a strong showing on Nintendo’s new console. If Microsoft does fully embrace Switch 2, it could be a windfall not just for the Xbox maker, but for Nintendo fans, who will have a big, broad range of very good franchises to play on their new systems.
Ubisoft is a longtime supporter of Nintendo consoles out of the gate, and it has a back catalog of Assassin’s Creed, Far Cry, and Tom Clancy games from the past decade it could repackage for the new and more powerful Nintendo handheld. Other publishers like Sega, Capcom, and Electronic Arts could follow with remasters and rereleases. Suffice it to say, AAA game makers have a potentially big new revenue stream with Switch 2, and I expect owners of the new system to be flush with choice.
That smorgasbord also includes indie games. Nintendo has shown strong support for independent game developers during the Switch era, with dedicated Indie World showcases, which I expect will continue on Switch 2. Are Switch indie devs like Team Cherry and Supergiant Games ready to drop their long-awaited sequels on Switch 2?
A late spring/early summer release for Switch 2 is looking more and more likely, based on the timing of Nintendo’s hands-on events for the console and Polygon’s own sources. We’ve heard that an early June launch is planned.
If that’s the case, a firm date should be announced at April’s Nintendo Direct. June is just two months away; retailers will need time to get up to speed and customers will need to get pre-orders in for Switch 2’s launch.
A bigger unknown, and one that feels a little fluid at this point, is price. While $399 seems like the sweet spot for Switch 2, a weak yen, fluctuating component costs, and price uncertainty related to tariffs threatened by the Trump administration could have an impact on Nintendo’s pricing decisions. Some analysts arepredicting a potentially higher price— upward of $499 — and if that’s the case, there will be one more question that’s yet to be answered: Will Switch 1 owners pay that much?
The best way to stay up to date on all things Nintendo Switch 2.
The best of Polygon in your inbox, every Friday."
Nintendo suggests there will be enhanced Switch 2 versions of some Switch games,2025-03-28T13:24:25Z,https://www.polygon.com/nintendo-switch-2/548599/nintendo-switch-2-edition-games-enhanced-upgrades,"Small print for Virtual Game Cards mentions ‘Nintendo Switch 2 Edition games’
byOli Welsh
If you buy something from a Polygon link, Vox Media may earn a commission.See our ethics statement.
In the small print ofan explainerabout its newVirtual Game Cardsystem for digital purchases, Nintendo appeared to confirm that some Switch games will get enhanced versions forSwitch 2— or at any rate, versions native to the Switch 2 console.
A footnote to the article reads, “Nintendo Switch 2 exclusive games and Nintendo Switch 2 Edition games can only be loaded on a Nintendo Switch 2 system.” The note also implies that the Switch 2 will use the Virtual Game Card system as well, and will be able to exchange Switch 1 games with an original Switch.
The Switch 2 is confirmed to be fully backward compatible with its predecessor’s software, so it will be able to play (almost) any Switch game regardless. But Nintendo’s mention of “Switch 2 Edition games,” as opposed to “Switch 2 exclusive games,” suggests that some Switch games will get cross-gen versions that run natively on Switch 2 rather than through the backward-compatibility layer.
This opens the door to enhanced versions of back-catalog titles, such asThe Legend of Zelda: Breath of the Wild, as well as upcoming Switch releases likeMetroid Prime 4: Beyond. It’s an expected move that has been made commonplace by the latest generations of PlayStation and Xbox consoles. But it’s still the first indication from Nintendo that it will go down this route for cross-gen releases.
It remains to be seen whether Nintendo will charge extra for Switch 2 Edition games. Sony did so for some PlayStation 5 upgrades of PlayStation 4 titles, while Microsoft elected to offer what it called Xbox Series X Enhanced versions of Xbox One games for free.
How the Switch 2 handles backward compatibility, and any potential performance enhancements for older games, is one of the bigger questions about the system ahead of itsfull reveal on April 2. This fine print answers one of our questions about it, but many more remain.
The best way to stay up to date on all things Nintendo Switch 2.
The best of Polygon in your inbox, every Friday."
Game of the Year 2025 predictions: The front-runners and challengers to come,2025-03-27T21:22:23Z,https://www.polygon.com/awards/546327/game-of-the-year-game-awards-2025-frontrunners,"What’s in pole position for gaming’s top prize? Let’s make some predictions
byOli Welsh
The 11th Game Awards, scheduled for Dec. 11, will come at the end of a watershed year for gaming that will see the launches ofNintendo Switch 2and (in theory)Grand Theft Auto 6. Both of those releases will likely loom large over theGame of the Yearcompetition at the leading awards ceremony for the game industry — the Oscars of gaming, as it were. But they are not the whole story. Even the first few months of 2025 have seen a number of surprisingly strong GOTY contenders come to light.
The Game Awards’ voting bodyis composed of a wide range of international games media (Polygon included), with a 10% contribution from fan voting. There area number of strong indicatorsfor what will perform well in the Game of the Year category. A high Metacritic rating (preferably over 90) is a must; role-playing games and action-adventures are strongly favored, as are games with strong narrative elements; indie and multiplayer games struggle harder for recognition than AAA single-player adventures. We used these metrics to correctly predict last year’s winner,Astro Bot. (We also got four of the six nominees right, and correctly called 14 other categories.)
Below, you’ll find our predictions for the most likely nominees, of which there are six each year, for Game of the Year 2025. Unlike the film industry, where most titles are known quantities well in advance, you never really know what kind of impact a video game will have, or how good it will be, until it’s out. With that in mind, this list only includes games that are already out. We’ll update these rankings throughout the year as new games are released. We’ll also list some likely upcoming contenders, and in future updates, we’ll predict some of the 2025 GOTY race’s dark horses, too.
Why it could win:Critical consensus is still the most reliable indicator of success at The Game Awards, and as the only game released so far this year with a rating over 90 on both Metacritic and OpenCritic, Hazelight’s co-op adventure is the clear front-runner in this regard. It’s got a legacy advantage, too: Hazelight’s previous game,It Takes Two, won GOTY in 2021, and since then has amassed amassive popular following. As a story-led action-adventure,Split Fictionalso belongs to a genre that the Game Awards jury has been known to favor in the past.
Weaknesses:PerhapsIt Takes Two’s win will count against it if jury members are looking for something different to reward. Also, whileIt Takes Two’s intensely personal story about divorce was unquestionably a strength,Split Fictionhas been praised more for its design than its abstract and overworked tale of writers adrift in virtual reality.
Why it could win:This could bethis year’sBlack Myth: Wukong: an ambitious hit game from a developer operating outside the gaming establishment, delivering on core gamers’ ardent desire for massive solo adventures made without compromise.Deliverance 2is a realistic medieval RPG with strong storytelling, and critics really liked it (its Metascore is 88). Another similar game might be the 2015 GOTY winner,The Witcher 3. This is right in The Game Awards’ sweet spot.
Weaknesses:Black Myth: Wukongdidn’t win GOTY— much to its producer’s chagrin. Just likeBlack Myth’s Game Science, Kingdom Come developer Warhorse is considered politically radioactive by some, after founder Daniel Vávra madepro-Gamergate commentsin 2015. Perhaps more to the point, the game is a challenging time sink that isn’t that broadly played among journalists and jurors, despite respectable sales.
Why it could win:Monster Hunter’s steady climb from co-op curio, through handheld sensation, to AAA champion climaxed with the huge sales and glowing reviews ofWilds. It’s slick, it’s gorgeous, and it’s sanded off Monster Hunter’s rough edges. (As a rule, the Game Awards jury isn’t keen on rough edges.)
Weaknesses:AlthoughWildsgestures toward a more conventional RPG storytelling style than previous Monster Hunters, this is still a deeply systemic game in which the equipment grind matters way more than players’ personal investment in the characters, and that’s not The Game Awards’ favorite look for a GOTY winner.
Why it could win:It only missed the deadline for the 2024 awards by a week or two, but MachineGames’ take on the indelible movie hero was swiftly acclaimed for all the things the jury likes to see: strong, performance-led storytelling, polished tech, high production values, a good mix of action and more cerebral play, and Troy Baker. It would almost certainly have been nominated for a GOTY 2024, and April’s PlayStation 5 release will be a big help in keepingGreat Circlein the conversation all the way up until the 2025 nomination process begins.
Weaknesses:PS5 release notwithstanding, 12 months is anawfullylong time to stay relevant in the race. The Game Awards do not typically reward licensed games. And the mid-80s Metacritic and OpenCritic scores are good, but indicate the critical consensus on this game is a little softer than it first appeared.
Why it could win:Obsidian Games’ traditional fantasy RPG is an interesting case. Its initial critical reception was on the soft side, but it has had a long tail and strong word of mouth, as players found its dependable, old-fashioned qualities — satisfying combat, excellent writing, and moreish loot — tough to turn away from. Genre-wise, as an undemanding and strongly narrative-focused RPG, it’s in a Game Awards sweet spot.Avowedis definitely undervalued, and though it will probably get pushed out of the likely nominees over the course of the year, it’s the definition of a dark horse.
Weaknesses:It would be very, very surprising for a game with a mere 80 Metascore to get nominated for Game of the Year. Surprising, but not unprecedented:Black Myth: Wukongmanaged it with an 81 Metascorelast year.
Why it could win:It might not be enough to save Ubisoft, but the whole gaming community heaved a sigh of relief when the first major Assassin’s Creed in four and a half years turned out to be good. This is AAA open-world gaming done right, with lavish production values and memorable characters.
Weaknesses:For whatever reason, the Game Awards jury is not that keen on Assassin’s Creed. 2018’sOdysseyis the only game in the series to score a Game of the Year nomination, and though it was nominated in four categories, it won none. Perhaps, like Call of Duty, the series’ heavily commercialized ubiquity is seen as a disqualifier by the judges.Shadows’ 81 Metascore is certainly too low to buck that trend.
Grant Theft Auto 6:It’s been such a long time since there was a mainline Grand Theft Auto game that The Game Awards weren’t around whenGTA 5was released. It’shard to see anything beating Rockstar’s behemoth— if, and it’s a big if, it makes its 2025 release date.
Metroid Prime 4: Beyond:Nintendo may well have multiple GOTY contenders in Switch 2’s release year, but the only one we know about for sure is Retro Studios’ very long-awaited return to the first-person sci-fi adventures of Samus.
Hades 2:Assuming it emerges from early access this year, Supergiant’s roguelike sequel will likely be leading the indie contenders for the year — out to avenge the original game’s perceived snub at the 2020 awards. (It’s eligible regardless, but the jury prefers not to nominate early access games.)
Death Stranding 2:Hideo Kojima is a Game Awards favorite and the originalDeath Strandingcontended strongly in 2019, although it ultimately lost toSekiro.Death Strandingwas divisive at the time, but in the years since, multiple rereleases have helped players get their heads around this singular vision, and with PlayStation’s full muscle behind it, the sequel is sure to make a big splash.
Ghost of Yōtei:No publisher has a better record at the Game Awards than Sony, and its other contender this year is this open-world samurai adventure — again, a sequel to a game (Ghost of Tsushima) whose reputation has only grown over time. If nothing else, this more rarefied, bespoke-feeling release will probably edge out the similarly themedAssassin’s Creed Shadows.
South of Midnight:The Game Awards jury is sure to love the culturally specific, character-forward storytelling of Compulsion Games’ occult adventure in the Deep South, which likely stands in for a delayedFable(and potentially replacesIndiana Jones) as Xbox Game Studios’ most likely contender. But its gameplay is an unknown quantity, and Compulsion’s record is a little patchy.
The best of Polygon in your inbox, every Friday."
